{"$schema":"https://json-schema.org/draft-07/schema#","description":"Common structure every VC8C cross-language fixture validates against. input has a fixtureId and inputHex; expected pins the allowed outputHex and failureCode (or the exact rejection code).","properties":{"assertion":{"type":"string"},"expected":{"properties":{"code":{"type":"string"},"ok":{"type":"boolean"}},"required":["ok"],"type":"object"},"expectedFailureCode":{"type":["string","null"]},"expectedOutputHex":{"type":"string"},"fixtureId":{"type":"string"},"id":{"type":"string"},"inputHex":{"type":"string"},"kind":{"enum":["cross-language-golden","cross-language-error","cross-language-truncated","cross-language-abi-mismatch","cross-language-platform","cross-language-missing","cross-language-abi-exchange","cross-language-error-code-exchange","cross-language-cargo-digest-mismatch"],"type":"string"},"producer":{"type":"string"},"schema":{"type":"string"}},"required":["id","producer","fixtureId","kind","inputHex","expectedOutputHex","expectedFailureCode","expected"],"title":"VC8C cross-language fixture envelope","type":"object"}
